{
  "contract": "gold_decision_case",
  "schema_version": "1.0.0",
  "case_id": "gd-regulatory-005",
  "dataset_id": "ai-lab-gold-decisions",
  "dataset_version": "1.0.0",
  "split": "development",
  "request": {
    "contract": "typed_decision_request",
    "schema_version": "1.0.0",
    "request_id": "gd-regulatory-005",
    "capability_id": "synthetic.decision.regulatory_relevance_triage",
    "execution_paradigm": "typed_decision",
    "decision_type": "choice",
    "bounded_state": {
      "facts": [
        {
          "fact_id": "notice.jurisdiction",
          "value_type": "string",
          "value": "CL"
        },
        {
          "fact_id": "notice.product_category",
          "value_type": "string",
          "value": "synthetic_category_a"
        },
        {
          "fact_id": "operation.destination_jurisdiction",
          "value_type": "string",
          "value": "CL"
        },
        {
          "fact_id": "operation.product_category",
          "value_type": "string",
          "value": "synthetic_category_d"
        }
      ]
    },
    "question": {
      "question_id": "synthetic.regulatory.relevance",
      "text": "Escenario sintético, sin asesoramiento legal. Regla sintética R-REG-1: si la jurisdicción del aviso es 'undeclared', abstenerse; si difiere del destino de la operación → no relevante; si coinciden y la categoría de producto de la operación es 'undeclared' → incierto; si coinciden y las categorías coinciden → relevante; si las categorías difieren → no relevante. ¿El aviso regulatorio sintético es relevante para la operación sintética?"
    },
    "output_domain": {
      "kind": "choice",
      "candidates": [
        {
          "candidate_id": "relevance.relevant",
          "label": "Relevante"
        },
        {
          "candidate_id": "relevance.not_relevant",
          "label": "No relevante"
        },
        {
          "candidate_id": "relevance.uncertain",
          "label": "Incierto"
        }
      ],
      "complete_distribution_required": false
    },
    "policy": {
      "data_classification": "internal",
      "human_review_required": true,
      "abstention_permitted": true,
      "escalation_policy_ref": null,
      "downstream_use": "none"
    },
    "evidence_refs": []
  },
  "expected": {
    "kind": "choice",
    "expected_candidate_id": "relevance.not_relevant"
  },
  "abstention_policy": "allowed",
  "permutation_group_id": null,
  "provenance": {
    "source_kind": "synthetic_construction",
    "authoring_method": "repository_fixture",
    "labeling_rule_id": "rule.regulatory_relevance.v1",
    "evidence_basis": [
      "notice.jurisdiction",
      "notice.product_category",
      "operation.destination_jurisdiction",
      "operation.product_category"
    ],
    "candidate_generated": false
  },
  "language": "es-AR",
  "jurisdiction": "CL",
  "tags": ["regulatory_relevance", "synthetic_regulatory_scenario"],
  "case_hash": "c94b338ba48e01dacae6b1b1612c88418dc1b8820a3d1e7efb1b6cf88d496e8c"
}
