{
  "contract": "gold_decision_case",
  "schema_version": "1.0.0",
  "case_id": "gd-evidence-005",
  "dataset_id": "ai-lab-gold-decisions",
  "dataset_version": "1.0.0",
  "split": "test",
  "request": {
    "contract": "typed_decision_request",
    "schema_version": "1.0.0",
    "request_id": "gd-evidence-005",
    "capability_id": "synthetic.decision.evidence_sufficiency",
    "execution_paradigm": "typed_decision",
    "decision_type": "choice",
    "bounded_state": {
      "facts": [
        {
          "fact_id": "evidence.required_items",
          "value_type": "integer",
          "value": 2
        },
        {
          "fact_id": "evidence.item.invoice.status",
          "value_type": "string",
          "value": "present_verified"
        },
        {
          "fact_id": "evidence.item.transport_document.status",
          "value_type": "string",
          "value": "present_verified"
        }
      ]
    },
    "question": {
      "question_id": "synthetic.evidence.sufficiency",
      "text": "Synthetic rule R-EVD-1: the evidence is sufficient when every required item is present_verified; insufficient when any required item is missing; uncertain when no item is missing and at least one is present_unverified. If the declared number of required items differs from the number of listed items, the facts contradict each other: abstain. How sufficient is the evidence for this synthetic file?"
    },
    "output_domain": {
      "kind": "choice",
      "candidates": [
        {
          "candidate_id": "evidence.sufficient",
          "label": "Sufficient"
        },
        {
          "candidate_id": "evidence.insufficient",
          "label": "Insufficient"
        },
        {
          "candidate_id": "evidence.uncertain",
          "label": "Uncertain"
        }
      ],
      "complete_distribution_required": false
    },
    "policy": {
      "data_classification": "internal",
      "human_review_required": true,
      "abstention_permitted": true,
      "escalation_policy_ref": null,
      "downstream_use": "none"
    },
    "evidence_refs": []
  },
  "expected": {
    "kind": "choice",
    "expected_candidate_id": "evidence.sufficient"
  },
  "abstention_policy": "allowed",
  "permutation_group_id": null,
  "provenance": {
    "source_kind": "synthetic_construction",
    "authoring_method": "repository_fixture",
    "labeling_rule_id": "rule.evidence_sufficiency.v1",
    "evidence_basis": [
      "evidence.item.invoice.status",
      "evidence.item.transport_document.status",
      "evidence.required_items"
    ],
    "candidate_generated": false
  },
  "language": "en",
  "jurisdiction": "NONE",
  "tags": ["evidence_sufficiency"],
  "case_hash": "906b427185b8d09d1a3c9f49565075273797be3aec46db8fb87c40068340b8b9"
}
