{
  "contract": "gold_decision_case",
  "schema_version": "1.0.0",
  "case_id": "gd-queue-001",
  "dataset_id": "ai-lab-gold-decisions",
  "dataset_version": "1.0.0",
  "split": "development",
  "request": {
    "contract": "typed_decision_request",
    "schema_version": "1.0.0",
    "request_id": "gd-queue-001",
    "capability_id": "synthetic.decision.document_queue_rank",
    "execution_paradigm": "typed_decision",
    "decision_type": "ranking",
    "bounded_state": {
      "facts": [
        {
          "fact_id": "queue.certificate.expires_in_days",
          "value_type": "integer",
          "value": 30
        },
        {
          "fact_id": "queue.invoice.expires_in_days",
          "value_type": "integer",
          "value": 10
        },
        {
          "fact_id": "queue.packing_list.expires_in_days",
          "value_type": "integer",
          "value": 20
        }
      ]
    },
    "question": {
      "question_id": "synthetic.document.queue_order",
      "text": "Regla sintética R-QUE-1: procesar los documentos en orden ascendente de días hasta su vencimiento. Ordená la cola sintética de documentos de la primera a la última."
    },
    "output_domain": {
      "kind": "ranking",
      "candidates": [
        {
          "candidate_id": "queue.certificate",
          "label": "Certificado"
        },
        {
          "candidate_id": "queue.invoice",
          "label": "Factura comercial"
        },
        {
          "candidate_id": "queue.packing_list",
          "label": "Lista de empaque"
        }
      ]
    },
    "policy": {
      "data_classification": "internal",
      "human_review_required": false,
      "abstention_permitted": true,
      "escalation_policy_ref": null,
      "downstream_use": "none"
    },
    "evidence_refs": []
  },
  "expected": {
    "kind": "ranking",
    "expected_order": [
      "queue.invoice",
      "queue.packing_list",
      "queue.certificate"
    ]
  },
  "abstention_policy": "not_allowed",
  "permutation_group_id": null,
  "provenance": {
    "source_kind": "synthetic_construction",
    "authoring_method": "repository_fixture",
    "labeling_rule_id": "rule.document_queue_order.v1",
    "evidence_basis": [
      "queue.certificate.expires_in_days",
      "queue.invoice.expires_in_days",
      "queue.packing_list.expires_in_days"
    ],
    "candidate_generated": false
  },
  "language": "es-AR",
  "jurisdiction": "NONE",
  "tags": ["document_queue"],
  "case_hash": "148a57a8a683e576ae75e03861da8d37258532d6a746ff7e4fc7ad0aaa1324b3"
}
