{
  "contract": "gold_decision_case",
  "schema_version": "1.0.0",
  "case_id": "gd-citation-002",
  "dataset_id": "ai-lab-gold-decisions",
  "dataset_version": "1.0.0",
  "split": "validation",
  "request": {
    "contract": "typed_decision_request",
    "schema_version": "1.0.0",
    "request_id": "gd-citation-002",
    "capability_id": "synthetic.decision.claim_citation_complete",
    "execution_paradigm": "typed_decision",
    "decision_type": "boolean",
    "bounded_state": {
      "facts": [
        {
          "fact_id": "packet.claims_count",
          "value_type": "integer",
          "value": 5
        },
        {
          "fact_id": "packet.claims_with_citation_count",
          "value_type": "integer",
          "value": 4
        }
      ]
    },
    "question": {
      "question_id": "synthetic.packet.fully_cited",
      "text": "Regla sintética R-CIT-1: un paquete está completamente citado cuando tiene al menos una afirmación y todas citan evidencia (claims_with_citation_count igual a claims_count). ¿Este paquete sintético está completamente citado?"
    },
    "output_domain": {
      "kind": "boolean"
    },
    "policy": {
      "data_classification": "internal",
      "human_review_required": false,
      "abstention_permitted": true,
      "escalation_policy_ref": null,
      "downstream_use": "none"
    },
    "evidence_refs": []
  },
  "expected": {
    "kind": "boolean",
    "expected_value": false
  },
  "abstention_policy": "not_allowed",
  "permutation_group_id": null,
  "provenance": {
    "source_kind": "synthetic_construction",
    "authoring_method": "repository_fixture",
    "labeling_rule_id": "rule.citation_completeness.v1",
    "evidence_basis": [
      "packet.claims_count",
      "packet.claims_with_citation_count"
    ],
    "candidate_generated": false
  },
  "language": "es-AR",
  "jurisdiction": "NONE",
  "tags": ["claim_citation"],
  "case_hash": "a3325b39e5eb3d8664cfed1dbbc8d5907b23d5bad26ca7218e63bb92ff5a86b7"
}
