{
  "contract": "gold_decision_case",
  "schema_version": "1.0.0",
  "case_id": "gd-doctype-006",
  "dataset_id": "ai-lab-gold-decisions",
  "dataset_version": "1.0.0",
  "split": "test",
  "request": {
    "contract": "typed_decision_request",
    "schema_version": "1.0.0",
    "request_id": "gd-doctype-006",
    "capability_id": "synthetic.decision.document_type_classify",
    "execution_paradigm": "typed_decision",
    "decision_type": "choice",
    "bounded_state": {
      "facts": [
        {
          "fact_id": "document.declared_title",
          "value_type": "string",
          "value": "Cardápio do evento de confraternização"
        },
        {
          "fact_id": "document.has_unit_prices",
          "value_type": "boolean",
          "value": false
        },
        {
          "fact_id": "document.has_package_weights",
          "value_type": "boolean",
          "value": false
        },
        {
          "fact_id": "document.has_certifying_body_declaration",
          "value_type": "boolean",
          "value": false
        },
        {
          "fact_id": "document.numbered_safety_sections",
          "value_type": "integer",
          "value": 0
        },
        {
          "fact_id": "document.has_carrier_and_ports",
          "value_type": "boolean",
          "value": false
        }
      ]
    },
    "question": {
      "question_id": "synthetic.document.type",
      "text": "Regra sintética R-DOC-1: um único marcador estrutural determina o tipo — preços unitários → fatura; pesos por volume → romaneio; declaração de organismo certificador → certificado; exatamente 16 seções de segurança numeradas → FDS; transportador mais portos de embarque e descarga → documento de transporte. Nenhum marcador → desconhecido. Dois ou mais marcadores → abster-se. O título declarado nunca prevalece sobre os marcadores. Qual é o tipo deste documento sintético?"
    },
    "output_domain": {
      "kind": "choice",
      "candidates": [
        {
          "candidate_id": "doc.invoice",
          "label": "Fatura comercial"
        },
        {
          "candidate_id": "doc.packing_list",
          "label": "Romaneio de carga (packing list)"
        },
        {
          "candidate_id": "doc.certificate",
          "label": "Certificado"
        },
        {
          "candidate_id": "doc.msds",
          "label": "Ficha de dados de segurança (FDS/MSDS)"
        },
        {
          "candidate_id": "doc.transport_document",
          "label": "Documento de transporte"
        },
        {
          "candidate_id": "doc.unknown",
          "label": "Desconhecido"
        }
      ],
      "complete_distribution_required": false
    },
    "policy": {
      "data_classification": "internal",
      "human_review_required": false,
      "abstention_permitted": true,
      "escalation_policy_ref": null,
      "downstream_use": "none"
    },
    "evidence_refs": []
  },
  "expected": {
    "kind": "choice",
    "expected_candidate_id": "doc.unknown"
  },
  "abstention_policy": "allowed",
  "permutation_group_id": null,
  "provenance": {
    "source_kind": "synthetic_construction",
    "authoring_method": "repository_fixture",
    "labeling_rule_id": "rule.document_type.v1",
    "evidence_basis": [
      "document.has_carrier_and_ports",
      "document.has_certifying_body_declaration",
      "document.has_package_weights",
      "document.has_unit_prices",
      "document.numbered_safety_sections"
    ],
    "candidate_generated": false
  },
  "language": "pt-BR",
  "jurisdiction": "NONE",
  "tags": ["document_classification"],
  "case_hash": "3babf7754b53ee82ccfb423498fe43e08d5b35d35c1f9c665f928d511ae9267c"
}
