{
  "contract": "gold_decision_case",
  "schema_version": "1.0.0",
  "case_id": "gd-doctype-011",
  "dataset_id": "ai-lab-gold-decisions",
  "dataset_version": "1.0.0",
  "split": "test",
  "request": {
    "contract": "typed_decision_request",
    "schema_version": "1.0.0",
    "request_id": "gd-doctype-011",
    "capability_id": "synthetic.decision.document_type_classify",
    "execution_paradigm": "typed_decision",
    "decision_type": "choice",
    "bounded_state": {
      "facts": [
        {
          "fact_id": "document.declared_title",
          "value_type": "string",
          "value": "Invoice INV-5520"
        },
        {
          "fact_id": "document.has_unit_prices",
          "value_type": "boolean",
          "value": true
        },
        {
          "fact_id": "document.has_package_weights",
          "value_type": "boolean",
          "value": false
        },
        {
          "fact_id": "document.has_certifying_body_declaration",
          "value_type": "boolean",
          "value": false
        },
        {
          "fact_id": "document.numbered_safety_sections",
          "value_type": "integer",
          "value": 0
        },
        {
          "fact_id": "document.has_carrier_and_ports",
          "value_type": "boolean",
          "value": false
        }
      ]
    },
    "question": {
      "question_id": "synthetic.document.type",
      "text": "Synthetic rule R-DOC-1: exactly one structural marker determines the type — unit prices → invoice; package weights → packing list; certifying body declaration → certificate; exactly 16 numbered safety sections → MSDS; carrier plus ports of loading and discharge → transport document. No marker → unknown. Two or more markers → abstain. The declared title never overrides the markers. Which document type is this synthetic document?"
    },
    "output_domain": {
      "kind": "choice",
      "candidates": [
        {
          "candidate_id": "doc.unknown",
          "label": "Unknown"
        },
        {
          "candidate_id": "doc.transport_document",
          "label": "Transport document"
        },
        {
          "candidate_id": "doc.msds",
          "label": "Material safety data sheet (MSDS)"
        },
        {
          "candidate_id": "doc.certificate",
          "label": "Certificate"
        },
        {
          "candidate_id": "doc.packing_list",
          "label": "Packing list"
        },
        {
          "candidate_id": "doc.invoice",
          "label": "Commercial invoice"
        }
      ],
      "complete_distribution_required": false
    },
    "policy": {
      "data_classification": "internal",
      "human_review_required": false,
      "abstention_permitted": true,
      "escalation_policy_ref": null,
      "downstream_use": "none"
    },
    "evidence_refs": []
  },
  "expected": {
    "kind": "choice",
    "expected_candidate_id": "doc.invoice"
  },
  "abstention_policy": "allowed",
  "permutation_group_id": "perm-doctype-invoice-en",
  "provenance": {
    "source_kind": "synthetic_construction",
    "authoring_method": "repository_fixture",
    "labeling_rule_id": "rule.document_type.v1",
    "evidence_basis": [
      "document.has_carrier_and_ports",
      "document.has_certifying_body_declaration",
      "document.has_package_weights",
      "document.has_unit_prices",
      "document.numbered_safety_sections"
    ],
    "candidate_generated": false
  },
  "language": "en",
  "jurisdiction": "NONE",
  "tags": ["document_classification", "permutation_pair"],
  "case_hash": "2a0ec0eaedbc3a8ec1f0ec85b1598d27279cc439ce3fe63b1419d83cefbe14b0"
}
